{
  "feature": "catalog-item-management",
  "version": "1.0",
  "extracted_from": ".migration/assess/features/catalog-item-management.md",
  "modules": ["web-controllers", "catalog-services", "domain-model", "views-and-static"],
  "migration_strategy": "Refactor",
  "target_platform": ".NET 8 / ASP.NET Core MVC + EF Core",
  "business_rules": [
    {
      "id": "BR-001",
      "description": "Catalog item Name is required.",
      "type": "validation",
      "condition": "catalogItem.Name is null or empty",
      "action": "ModelState invalid; reject create/edit and redisplay form",
      "source": "src/eShopLegacyMVC/Models/CatalogItem.cs:16-17",
      "confidence": "clear",
      "dependencies": [],
      "data_fields": ["CatalogItem.Name"]
    },
    {
      "id": "BR-002",
      "description": "Price must be a positive number, at most 1,000,000, with a maximum of two decimal places, treated as currency.",
      "type": "validation",
      "condition": "Price not matching ^\\d+(\\.\\d{0,2})*$ OR Price outside [0, 1000000]",
      "action": "ModelState invalid; reject with message 'The field Price must be a positive number with maximum two decimals.'",
      "source": "src/eShopLegacyMVC/Models/CatalogItem.cs:22-25",
      "confidence": "clear",
      "dependencies": [],
      "data_fields": ["CatalogItem.Price"]
    },
    {
      "id": "BR-003",
      "description": "AvailableStock must be between 0 and 10,000,000.",
      "type": "validation",
      "condition": "AvailableStock < 0 OR AvailableStock > 10000000",
      "action": "ModelState invalid with message 'The field Stock must be between 0 and 10 million.'",
      "source": "src/eShopLegacyMVC/Models/CatalogItem.cs:45-47",
      "confidence": "clear",
      "dependencies": [],
      "data_fields": ["CatalogItem.AvailableStock"]
    },
    {
      "id": "BR-004",
      "description": "RestockThreshold must be between 0 and 10,000,000.",
      "type": "validation",
      "condition": "RestockThreshold < 0 OR RestockThreshold > 10000000",
      "action": "ModelState invalid with message 'The field Restock must be between 0 and 10 million.'",
      "source": "src/eShopLegacyMVC/Models/CatalogItem.cs:50-52",
      "confidence": "clear",
      "dependencies": [],
      "data_fields": ["CatalogItem.RestockThreshold"]
    },
    {
      "id": "BR-005",
      "description": "MaxStockThreshold must be between 0 and 10,000,000.",
      "type": "validation",
      "condition": "MaxStockThreshold < 0 OR MaxStockThreshold > 10000000",
      "action": "ModelState invalid with message 'The field Max stock must be between 0 and 10 million.'",
      "source": "src/eShopLegacyMVC/Models/CatalogItem.cs:55-57",
      "confidence": "clear",
      "dependencies": [],
      "data_fields": ["CatalogItem.MaxStockThreshold"]
    },
    {
      "id": "BR-006",
      "description": "Details, Edit, and Delete GET requests require a non-null id.",
      "type": "validation",
      "condition": "id == null",
      "action": "Return HTTP 400 BadRequest",
      "source": "src/eShopLegacyMVC/Controllers/CatalogController.cs:34-37",
      "confidence": "clear",
      "dependencies": [],
      "data_fields": ["CatalogItem.Id"]
    },
    {
      "id": "BR-007",
      "description": "When a requested catalog item id does not exist, return Not Found.",
      "type": "routing",
      "condition": "service.FindCatalogItem(id) returns null",
      "action": "Return HTTP 404 (HttpNotFound)",
      "source": "src/eShopLegacyMVC/Controllers/CatalogController.cs:39-42",
      "confidence": "clear",
      "dependencies": ["BR-006"],
      "data_fields": ["CatalogItem.Id"]
    },
    {
      "id": "BR-008",
      "description": "Catalog listing is paginated: items ordered by Id, skipping pageSize*pageIndex and taking pageSize; brand and type are eager-loaded.",
      "type": "calculation",
      "condition": "GetCatalogItemsPaginated(pageSize, pageIndex)",
      "action": "Return items ordered by Id with Skip(pageSize*pageIndex).Take(pageSize), including CatalogBrand and CatalogType",
      "source": "src/eShopLegacyMVC/Services/CatalogService.cs:25-31",
      "confidence": "clear",
      "dependencies": [],
      "data_fields": ["CatalogItem.Id", "CatalogItem.CatalogBrand", "CatalogItem.CatalogType"]
    },
    {
      "id": "BR-009",
      "description": "Total page count is the ceiling of total items divided by page size.",
      "type": "calculation",
      "condition": "constructing PaginatedItemsViewModel",
      "action": "TotalPages = ceil(count / pageSize)",
      "source": "src/eShopLegacyMVC/ViewModel/PaginatedItemsViewModel.cs:23",
      "confidence": "clear",
      "dependencies": ["BR-008"],
      "data_fields": ["PaginatedItemsViewModel.TotalPages", "PaginatedItemsViewModel.TotalItems", "PaginatedItemsViewModel.ItemsPerPage"]
    },
    {
      "id": "BR-010",
      "description": "Each catalog item's PictureUri is computed from the GetPicRouteTemplate route using the item's Id and the request scheme; it is not stored.",
      "type": "transformation",
      "condition": "rendering an item to a view",
      "action": "item.PictureUri = Url.RouteUrl('GetPicRouteTemplate', { catalogItemId = item.Id }, request scheme)",
      "source": "src/eShopLegacyMVC/Controllers/CatalogController.cs:160-163",
      "confidence": "clear",
      "dependencies": [],
      "data_fields": ["CatalogItem.PictureUri", "CatalogItem.Id"]
    },
    {
      "id": "BR-011",
      "description": "On create, a new catalog item's Id is assigned from the HiLo generator before insertion (Id is application-assigned, not database identity).",
      "type": "state-transition",
      "condition": "CreateCatalogItem(catalogItem)",
      "action": "catalogItem.Id = indexGenerator.GetNextSequenceValue(db); add and SaveChanges",
      "source": "src/eShopLegacyMVC/Services/CatalogService.cs:51-56",
      "confidence": "clear",
      "dependencies": ["BR-016"],
      "data_fields": ["CatalogItem.Id"]
    },
    {
      "id": "BR-012",
      "description": "Create, Edit, and Delete POST actions require a valid anti-forgery token and bind only an explicit allow-list of fields (overposting protection).",
      "type": "authorization",
      "condition": "HTTP POST to Create/Edit/Delete",
      "action": "Validate anti-forgery token; bind only Id,Name,Description,Price,PictureFileName,CatalogTypeId,CatalogBrandId,AvailableStock,RestockThreshold,MaxStockThreshold,OnReorder",
      "source": "src/eShopLegacyMVC/Controllers/CatalogController.cs:60-62",
      "confidence": "clear",
      "dependencies": [],
      "data_fields": ["CatalogItem.Id", "CatalogItem.Name", "CatalogItem.Price"]
    },
    {
      "id": "BR-013",
      "description": "Create and Edit persist changes only when ModelState is valid; otherwise the form is redisplayed with brand/type dropdowns.",
      "type": "routing",
      "condition": "ModelState.IsValid",
      "action": "If valid: persist and redirect to Index. If invalid: repopulate ViewBag SelectLists and return the view with the submitted item.",
      "source": "src/eShopLegacyMVC/Controllers/CatalogController.cs:65-73",
      "confidence": "clear",
      "dependencies": ["BR-001", "BR-002", "BR-003", "BR-004", "BR-005"],
      "data_fields": ["CatalogItem.CatalogBrandId", "CatalogItem.CatalogTypeId"]
    },
    {
      "id": "BR-014",
      "description": "A new catalog item defaults its PictureFileName to 'dummy.png'.",
      "type": "transformation",
      "condition": "new CatalogItem() constructed",
      "action": "PictureFileName = DefaultPictureName ('dummy.png')",
      "source": "src/eShopLegacyMVC/Models/CatalogItem.cs:8-13",
      "confidence": "clear",
      "dependencies": [],
      "data_fields": ["CatalogItem.PictureFileName"]
    },
    {
      "id": "BR-015",
      "description": "Update replaces the catalog item: EF marks the entity Modified and saves; the mock replaces the item in its in-memory list by Id.",
      "type": "state-transition",
      "condition": "UpdateCatalogItem(catalogItem)",
      "action": "EF: db.Entry(item).State = Modified; SaveChanges. Mock: replace existing item at its index.",
      "source": "src/eShopLegacyMVC/Services/CatalogService.cs:58-62",
      "confidence": "clear",
      "dependencies": [],
      "data_fields": ["CatalogItem.Id"]
    },
    {
      "id": "BR-016",
      "description": "HiLo id allocation fetches the next value from the catalog_hilo SQL sequence and hands out 10 consecutive ids per database round-trip, guarded by a lock.",
      "type": "calculation",
      "condition": "GetNextSequenceValue(db)",
      "action": "If no remaining lo ids: read 'SELECT NEXT VALUE FOR catalog_hilo', cache and return; otherwise increment and return the cached id. HiLoIncrement = 10.",
      "source": "src/eShopLegacyMVC/Models/CatalogItemHiLoGenerator.cs:11-33",
      "confidence": "clear",
      "dependencies": [],
      "data_fields": ["CatalogItem.Id"]
    },
    {
      "id": "BR-017",
      "description": "Delete removes the catalog item found by id, then redirects to the listing.",
      "type": "state-transition",
      "condition": "DeleteConfirmed(id) POST",
      "action": "item = FindCatalogItem(id); RemoveCatalogItem(item); redirect to Index",
      "source": "src/eShopLegacyMVC/Controllers/CatalogController.cs:134-139",
      "confidence": "clear",
      "dependencies": ["BR-007"],
      "data_fields": ["CatalogItem.Id"]
    }
  ],
  "data_model": [
    {
      "name": "CatalogItem",
      "source": "src/eShopLegacyMVC/Models/CatalogItem.cs:6-63",
      "fields": [
        {"name": "Id", "type": "int", "target_type": "int", "nullable": false, "constraints": ["PRIMARY KEY", "DatabaseGenerated(None)"], "used_by_rules": ["BR-006", "BR-007", "BR-008", "BR-011", "BR-015", "BR-016", "BR-017"], "description": "Application-assigned identifier (HiLo). Mapped to Catalog table.Id"},